{
  "name": "waiting-question",
  "description": "Question is waiting on PC; mobile displays read-only attention and low-sensitive notification.",
  "envelope": {
    "protocolVersion": 1,
    "messageId": "msg_fixture_waiting_question",
    "seq": 1003,
    "kind": "notification",
    "sentAt": "2026-06-17T08:02:00Z",
    "snapshotVersion": 1003,
    "payload": {
      "protocolVersion": 1,
      "snapshotVersion": 1003,
      "snapshotId": "snap_fixture_waiting_question",
      "generatedAt": "2026-06-17T08:02:00Z",
      "displayMode": "trustedAppView",
      "privacyLevel": "trustedAppView",
      "summary": { "status": "waiting", "statusText": "Claude has a question", "activeSessionCount": 1, "attentionCount": 1, "notificationCount": 1, "modelLabel": "Sonnet 4.6", "projectLabel": "claude-hud-one" },
      "displayPolicy": { "visibleItems": ["activity", "project", "model", "tools", "contextValue"], "hiddenByDesktopConfig": [], "terminalJump": false, "approvalActions": false, "questionActions": false, "notificationsEnabled": true, "privacyNote": "Mobile is read-only for questions." },
      "capsule": { "mascot": "clawd", "state": "waiting", "title": "Claude HUD One", "statusText": "Claude has a question", "ticker": [{ "id": "activity", "label": "Activity", "value": "Question waiting", "emphasis": "warning" }] },
      "sessions": [{ "sessionRef": "session_fixture_question", "sessionName": "Android HUD", "projectLabel": "claude-hud-one", "activity": "waiting", "statusText": "Claude has a question", "modelLabel": "Sonnet 4.6", "contextUsedPercent": 51, "inputTokens": 1800, "outputTokens": 620, "totalCostUsd": 0.21, "updatedAt": "2026-06-17T08:01:55Z", "privacyNote": "Sanitized mobile session card." }],
      "attention": [{ "itemRef": "att_fixture_question", "sessionRef": "session_fixture_question", "kind": "question", "status": "pending", "title": "Question waiting", "summary": "Answer from the PC HUD or terminal.", "createdAt": "2026-06-17T08:01:55Z", "actionState": "readonly", "privacyNote": "No answer channel is exposed in Mobile HUD Phase 1." }],
      "notificationEvents": [{ "eventId": "evt_fixture_question", "dedupeKey": "attention:session_fixture_question:att_fixture_question", "collapseKey": "attention:session_fixture_question", "kind": "waitingAttention", "sensitivity": "low", "title": "Claude needs attention", "body": "A Claude Code question is waiting on your PC.", "createdAt": "2026-06-17T08:01:55Z", "source": "pendingQueue", "targetSessionRef": "session_fixture_question" }]
    }
  },
  "androidFallback": {}
}
